"No.","Time","Source","src.port","Destination","dst.port","Protocol","Length","Info"
"1","0.000000000","146.57.254.72","80","192.168.91.128","49438","TCP","54","80 > 49438 [FIN, PSH, ACK] Seq=1 Ack=1 Win=64240 Len=0"
"2","0.000018000","146.57.254.72","80","192.168.91.128","49436","TCP","54","80 > 49436 [FIN, PSH, ACK] Seq=1 Ack=1 Win=64240 Len=0"
"3","0.000022000","146.57.254.72","80","192.168.91.128","49437","TCP","54","80 > 49437 [FIN, PSH, ACK] Seq=1 Ack=1 Win=64240 Len=0"
"4","0.000025000","23.38.132.228","80","192.168.91.128","49439","TCP","54","80 > 49439 [FIN, PSH, ACK] Seq=1 Ack=1 Win=64240 Len=0"
"53","1.275843000","192.168.91.128","49180","124.6.36.194","443","TLSv1.2","597","Application Data"
"54","1.275900000","124.6.36.194","443","192.168.91.128","49180","TCP","54","443 > 49180 [ACK] Seq=1 Ack=544 Win=64240 Len=0"
"63","1.456370000","124.6.36.194","443","192.168.91.128","49180","TLSv1.2","597","Application Data"
"64","1.456852000","124.6.36.194","443","192.168.91.128","49180","TCP","1514","[TCP segment of a reassembled PDU]"
"65","1.456874000","124.6.36.194","443","192.168.91.128","49180","TCP","1514","[TCP segment of a reassembled PDU]"
"66","1.456953000","192.168.91.128","49180","124.6.36.194","443","TCP","54","49180 > 443 [ACK] Seq=544 Ack=3464 Win=64240 Len=0"
"71","1.554537000","124.6.36.194","443","192.168.91.128","49180","TLSv1.2","247","Application Data"
"72","1.567883000","192.168.91.128","49180","124.6.36.194","443","TCP","54","49180 > 443 [ACK] Seq=544 Ack=3657 Win=64047 Len=0"
"73","1.574137000","192.168.91.128","49180","124.6.36.194","443","TLSv1.2","1111","Application Data"
"74","1.574220000","124.6.36.194","443","192.168.91.128","49180","TCP","54","443 > 49180 [ACK] Seq=3657 Ack=1601 Win=64240 Len=0"
"75","1.603477000","192.168.91.128","49180","124.6.36.194","443","TCP","1514","[TCP segment of a reassembled PDU]"
"76","1.603492000","192.168.91.128","49180","124.6.36.194","443","TLSv1.2","679","Application Data"
"77","1.603548000","124.6.36.194","443","192.168.91.128","49180","TCP","54","443 > 49180 [ACK] Seq=3657 Ack=3061 Win=64240 Len=0"
"78","1.603565000","124.6.36.194","443","192.168.91.128","49180","TCP","54","443 > 49180 [ACK] Seq=3657 Ack=3686 Win=64240 Len=0"
"83","1.625901000","192.168.91.128","49180","124.6.36.194","443","TLSv1.2","1111","Application Data"
"84","1.625970000","124.6.36.194","443","192.168.91.128","49180","TCP","54","443 > 49180 [ACK] Seq=3657 Ack=4743 Win=64240 Len=0"
"85","1.672395000","192.168.91.128","49180","124.6.36.194","443","TLSv1.2","1111","Application Data"
"86","1.672455000","124.6.36.194","443","192.168.91.128","49180","TCP","54","443 > 49180 [ACK] Seq=3657 Ack=5800 Win=64240 Len=0"
"91","1.787301000","124.6.36.194","443","192.168.91.128","49180","TLSv1.2","597","Application Data"
"92","1.798210000","192.168.91.128","49180","124.6.36.194","443","TCP","54","49180 > 443 [ACK] Seq=5800 Ack=4200 Win=63504 Len=0"
"97","1.814590000","124.6.36.194","443","192.168.91.128","49180","TLSv1.2","1514","Application Data, Application Data"
"98","1.814686000","124.6.36.194","443","192.168.91.128","49180","TLSv1.2","1514","Application Data"
"99","1.814695000","124.6.36.194","443","192.168.91.128","49180","TCP","1514","[TCP segment of a reassembled PDU]"
"100","1.814890000","192.168.91.128","49180","124.6.36.194","443","TCP","54","49180 > 443 [ACK] Seq=5800 Ack=8580 Win=64240 Len=0"
"101","1.842422000","124.6.36.194","443","192.168.91.128","49180","TLSv1.2","1514","Application Data"
"102","1.846732000","192.168.91.128","49180","124.6.36.194","443","TLSv1.2","597","Application Data"
"103","1.846792000","124.6.36.194","443","192.168.91.128","49180","TCP","54","443 > 49180 [ACK] Seq=10040 Ack=6343 Win=64240 Len=0"
"104","1.890362000","124.6.36.194","443","192.168.91.128","49180","TLSv1.2","1514","Application Data"
"105","1.897493000","124.6.36.194","443","192.168.91.128","49180","TLSv1.2","1514","Application Data"
"106","1.897616000","192.168.91.128","49180","124.6.36.194","443","TCP","54","49180 > 443 [ACK] Seq=6343 Ack=12960 Win=64240 Len=0"
"111","1.912402000","124.6.36.194","443","192.168.91.128","49180","TLSv1.2","1514","Application Data"
"112","1.912489000","124.6.36.194","443","192.168.91.128","49180","TCP","1514","[TCP segment of a reassembled PDU]"
"113","1.912494000","124.6.36.194","443","192.168.91.128","49180","TLSv1.2","1514","Application Data"
"114","1.912584000","192.168.91.128","49180","124.6.36.194","443","TCP","54","49180 > 443 [ACK] Seq=6343 Ack=17340 Win=64240 Len=0"
"115","1.912665000","124.6.36.194","443","192.168.91.128","49180","TCP","1514","[TCP segment of a reassembled PDU]"
"116","1.912673000","124.6.36.194","443","192.168.91.128","49180","TLSv1.2","1514","Application Data"
"117","1.912678000","124.6.36.194","443","192.168.91.128","49180","TCP","223","[TCP segment of a reassembled PDU]"
"118","1.912741000","192.168.91.128","49180","124.6.36.194","443","TCP","54","49180 > 443 [ACK] Seq=6343 Ack=20429 Win=64240 Len=0"
"119","1.945041000","124.6.36.194","443","192.168.91.128","49180","TLSv1.2","1514","Application Data"
"120","1.945071000","124.6.36.194","443","192.168.91.128","49180","TCP","1514","[TCP segment of a reassembled PDU]"
"121","1.945153000","192.168.91.128","49180","124.6.36.194","443","TCP","54","49180 > 443 [ACK] Seq=6343 Ack=23349 Win=64240 Len=0"
"122","1.948712000","192.168.91.128","49180","124.6.36.194","443","TLSv1.2","1111","Application Data"
"123","1.948776000","124.6.36.194","443","192.168.91.128","49180","TCP","54","443 > 49180 [ACK] Seq=23349 Ack=7400 Win=64240 Len=0"
"124","1.952379000","192.168.91.128","49180","124.6.36.194","443","TLSv1.2","597","Application Data"
"125","1.952424000","124.6.36.194","443","192.168.91.128","49180","TCP","54","443 > 49180 [ACK] Seq=23349 Ack=7943 Win=64240 Len=0"
"126","1.995534000","124.6.36.194","443","192.168.91.128","49180","TLSv1.2","1514","Application Data"
"127","1.995697000","124.6.36.194","443","192.168.91.128","49180","TCP","1514","[TCP segment of a reassembled PDU]"
"128","1.995705000","124.6.36.194","443","192.168.91.128","49180","TCP","1514","[TCP segment of a reassembled PDU]"
"129","1.995811000","192.168.91.128","49180","124.6.36.194","443","TCP","54","49180 > 443 [ACK] Seq=7943 Ack=27729 Win=64240 Len=0"
"134","2.010495000","124.6.36.194","443","192.168.91.128","49180","TLSv1.2","1514","Application Data"
"135","2.010506000","124.6.36.194","443","192.168.91.128","49180","TLSv1.2","1514","Application Data"
"136","2.010511000","124.6.36.194","443","192.168.91.128","49180","TLSv1.2","1514","Application Data"
"137","2.010620000","192.168.91.128","49180","124.6.36.194","443","TCP","54","49180 > 443 [ACK] Seq=7943 Ack=32109 Win=64240 Len=0"
"138","2.010623000","124.6.36.194","443","192.168.91.128","49180","TCP","1514","[TCP segment of a reassembled PDU]"
"139","2.010709000","192.168.91.128","49180","124.6.36.194","443","TCP","54","49180 > 443 [ACK] Seq=7943 Ack=33569 Win=64240 Len=0"
"140","2.010757000","124.6.36.194","443","192.168.91.128","49180","TLSv1.2","1514","Application Data"
"141","2.010768000","124.6.36.194","443","192.168.91.128","49180","TLSv1.2","1514","Application Data"
"142","2.010782000","124.6.36.194","443","192.168.91.128","49180","TLSv1.2","1514","Application Data"
"143","2.010786000","124.6.36.194","443","192.168.91.128","49180","TLSv1.2","1514","Application Data"
"144","2.010800000","124.6.36.194","443","192.168.91.128","49180","TLSv1.2","1181","Application Data"
"145","2.011030000","192.168.91.128","49180","124.6.36.194","443","TCP","54","49180 > 443 [ACK] Seq=7943 Ack=40536 Win=64240 Len=0"
"146","2.011256000","192.168.91.128","49180","124.6.36.194","443","TLSv1.2","597","Application Data"
"147","2.011291000","124.6.36.194","443","192.168.91.128","49180","TCP","54","443 > 49180 [ACK] Seq=40536 Ack=8486 Win=64240 Len=0"
"148","2.017912000","192.168.91.128","49180","124.6.36.194","443","TLSv1.2","597","Application Data"
"149","2.017955000","124.6.36.194","443","192.168.91.128","49180","TCP","54","443 > 49180 [ACK] Seq=40536 Ack=9029 Win=64240 Len=0"
"150","2.059551000","124.6.36.194","443","192.168.91.128","49180","TLSv1.2","1514","Application Data"
"151","2.059565000","124.6.36.194","443","192.168.91.128","49180","TCP","1514","[TCP segment of a reassembled PDU]"
"152","2.059569000","124.6.36.194","443","192.168.91.128","49180","TCP","1514","[TCP segment of a reassembled PDU]"
"153","2.060021000","192.168.91.128","49180","124.6.36.194","443","TCP","54","49180 > 443 [ACK] Seq=9029 Ack=44916 Win=64240 Len=0"
"154","2.093516000","124.6.36.194","443","192.168.91.128","49180","TLSv1.2","1514","Application Data"
"155","2.093530000","124.6.36.194","443","192.168.91.128","49180","TLSv1.2","1514","Application Data"
"156","2.093658000","192.168.91.128","49180","124.6.36.194","443","TCP","54","49180 > 443 [ACK] Seq=9029 Ack=47836 Win=64240 Len=0"
"157","2.093779000","124.6.36.194","443","192.168.91.128","49180","TLSv1.2","1514","Application Data"
"158","2.093788000","124.6.36.194","443","192.168.91.128","49180","TCP","1514","[TCP segment of a reassembled PDU]"
"159","2.093858000","124.6.36.194","443","192.168.91.128","49180","TCP","1514","[TCP segment of a reassembled PDU]"
"160","2.093887000","192.168.91.128","49180","124.6.36.194","443","TCP","54","49180 > 443 [ACK] Seq=9029 Ack=50756 Win=64240 Len=0"
"165","2.108267000","124.6.36.194","443","192.168.91.128","49180","TLSv1.2","1514","Application Data"
"166","2.108345000","192.168.91.128","49180","124.6.36.194","443","TCP","54","49180 > 443 [ACK] Seq=9029 Ack=53676 Win=64240 Len=0"
"167","2.108679000","124.6.36.194","443","192.168.91.128","49180","TLSv1.2","1053","Application Data"
"168","2.109262000","192.168.91.128","49180","124.6.36.194","443","TLSv1.2","597","Application Data"
"169","2.109298000","124.6.36.194","443","192.168.91.128","49180","TCP","54","443 > 49180 [ACK] Seq=54675 Ack=9572 Win=64240 Len=0"
"174","2.245751000","124.6.36.194","443","192.168.91.128","49180","TLSv1.2","1514","Application Data"
"175","2.245920000","124.6.36.194","443","192.168.91.128","49180","TCP","1514","[TCP segment of a reassembled PDU]"
"176","2.246017000","192.168.91.128","49180","124.6.36.194","443","TCP","54","49180 > 443 [ACK] Seq=9572 Ack=57595 Win=64240 Len=0"
"177","2.246854000","192.168.91.128","49180","124.6.36.194","443","TLSv1.2","1111","Application Data"
"178","2.246879000","124.6.36.194","443","192.168.91.128","49180","TCP","54","443 > 49180 [ACK] Seq=57595 Ack=10629 Win=64240 Len=0"
"179","2.257880000","124.6.36.194","443","192.168.91.128","49180","TLSv1.2","790","Application Data"
"180","2.266540000","124.6.36.194","443","192.168.91.128","49180","TLSv1.2","1514","Application Data"
"181","2.266675000","192.168.91.128","49180","124.6.36.194","443","TCP","54","49180 > 443 [ACK] Seq=10629 Ack=59791 Win=64240 Len=0"
"182","2.273403000","124.6.36.194","443","192.168.91.128","49180","TLSv1.2","1514","Application Data"
"183","2.273465000","124.6.36.194","443","192.168.91.128","49180","TLSv1.2","1514","Application Data"
"184","2.273702000","192.168.91.128","49180","124.6.36.194","443","TCP","54","49180 > 443 [ACK] Seq=10629 Ack=62711 Win=64240 Len=0"
"185","2.287226000","124.6.36.194","443","192.168.91.128","49180","TLSv1.2","1514","Application Data"
"186","2.287293000","124.6.36.194","443","192.168.91.128","49180","TLSv1.2","1514","Application Data"
"187","2.287378000","192.168.91.128","49180","124.6.36.194","443","TCP","54","49180 > 443 [ACK] Seq=10629 Ack=65631 Win=64240 Len=0"
"188","2.291485000","192.168.91.128","49180","124.6.36.194","443","TLSv1.2","597","Application Data"
"189","2.291527000","124.6.36.194","443","192.168.91.128","49180","TCP","54","443 > 49180 [ACK] Seq=65631 Ack=11172 Win=64240 Len=0"
"194","2.336733000","124.6.36.194","443","192.168.91.128","49180","TLSv1.2","1514","Application Data"
"195","2.336992000","192.168.91.128","49180","124.6.36.194","443","TLSv1.2","597","Application Data"
"196","2.337028000","124.6.36.194","443","192.168.91.128","49180","TCP","54","443 > 49180 [ACK] Seq=67091 Ack=11715 Win=64240 Len=0"
"197","2.337161000","124.6.36.194","443","192.168.91.128","49180","TLSv1.2","1514","Application Data"
"198","2.337283000","124.6.36.194","443","192.168.91.128","49180","TCP","1514","[TCP segment of a reassembled PDU]"
"199","2.337406000","192.168.91.128","49180","124.6.36.194","443","TCP","54","49180 > 443 [ACK] Seq=11715 Ack=70011 Win=64240 Len=0"
"200","2.339682000","124.6.36.194","443","192.168.91.128","49180","TLSv1.2","1514","Application Data"
"201","2.339692000","124.6.36.194","443","192.168.91.128","49180","TCP","1514","[TCP segment of a reassembled PDU]"
"202","2.340202000","192.168.91.128","49180","124.6.36.194","443","TCP","54","49180 > 443 [ACK] Seq=11715 Ack=72931 Win=64240 Len=0"
"203","2.340359000","192.168.91.128","49180","124.6.36.194","443","TLSv1.2","597","Application Data"
"204","2.340402000","124.6.36.194","443","192.168.91.128","49180","TCP","54","443 > 49180 [ACK] Seq=72931 Ack=12258 Win=64240 Len=0"
"205","2.355726000","124.6.36.194","443","192.168.91.128","49180","TLSv1.2","766","Application Data"
"206","2.365745000","192.168.91.128","49180","124.6.36.194","443","TCP","54","49180 > 443 [ACK] Seq=12258 Ack=73643 Win=63528 Len=0"
"207","2.392865000","192.168.91.128","49180","124.6.36.194","443","TLSv1.2","1111","Application Data"
"208","2.392917000","124.6.36.194","443","192.168.91.128","49180","TCP","54","443 > 49180 [ACK] Seq=73643 Ack=13315 Win=64240 Len=0"
"209","2.399289000","192.168.91.128","49180","124.6.36.194","443","TLSv1.2","1111","Application Data"
"210","2.399367000","124.6.36.194","443","192.168.91.128","49180","TCP","54","443 > 49180 [ACK] Seq=73643 Ack=14372 Win=64240 Len=0"
"211","2.403089000","192.168.91.128","49180","124.6.36.194","443","TLSv1.2","1111","Application Data"
"212","2.403132000","124.6.36.194","443","192.168.91.128","49180","TCP","54","443 > 49180 [ACK] Seq=73643 Ack=15429 Win=64240 Len=0"
"217","2.503072000","124.6.36.194","443","192.168.91.128","49180","TLSv1.2","1514","Application Data"
"218","2.503086000","124.6.36.194","443","192.168.91.128","49180","TCP","1514","[TCP segment of a reassembled PDU]"
"219","2.503090000","124.6.36.194","443","192.168.91.128","49180","TCP","597","[TCP segment of a reassembled PDU]"
"220","2.503178000","192.168.91.128","49180","124.6.36.194","443","TCP","54","49180 > 443 [ACK] Seq=15429 Ack=77106 Win=64240 Len=0"
"225","2.555036000","124.6.36.194","443","192.168.91.128","49180","TLSv1.2","1514","Application Data"
"226","2.563873000","192.168.91.128","49180","124.6.36.194","443","TCP","54","49180 > 443 [ACK] Seq=15429 Ack=78566 Win=64240 Len=0"
"227","2.600985000","124.6.36.194","443","192.168.91.128","49180","TLSv1.2","959","Application Data"
"232","2.613932000","192.168.91.128","49180","124.6.36.194","443","TCP","54","49180 > 443 [ACK] Seq=15429 Ack=79471 Win=63335 Len=0"
"233","2.698812000","124.6.36.194","443","192.168.91.128","49180","TLSv1.2","597","Application Data"
"238","2.709612000","192.168.91.128","49180","124.6.36.194","443","TCP","54","49180 > 443 [ACK] Seq=15429 Ack=80014 Win=62792 Len=0"
"243","2.847657000","124.6.36.194","443","192.168.91.128","49180","TLSv1.2","597","Application Data"
"244","2.858774000","192.168.91.128","49180","124.6.36.194","443","TCP","54","49180 > 443 [ACK] Seq=15429 Ack=80557 Win=64240 Len=0"
"245","2.887209000","124.6.36.194","443","192.168.91.128","49180","TLSv1.2","1514","Application Data"
"246","2.887230000","124.6.36.194","443","192.168.91.128","49180","TCP","1514","[TCP segment of a reassembled PDU]"
"247","2.887367000","192.168.91.128","49180","124.6.36.194","443","TCP","54","49180 > 443 [ACK] Seq=15429 Ack=83477 Win=64240 Len=0"
"248","2.894539000","124.6.36.194","443","192.168.91.128","49180","TLSv1.2","1514","Application Data"
"249","2.895942000","192.168.91.128","49180","124.6.36.194","443","TLSv1.2","597","Application Data"
"250","2.896005000","124.6.36.194","443","192.168.91.128","49180","TCP","54","443 > 49180 [ACK] Seq=84937 Ack=15972 Win=64240 Len=0"
"255","2.985141000","124.6.36.194","443","192.168.91.128","49180","TLSv1.2","416","Application Data"
"256","2.995313000","192.168.91.128","49180","124.6.36.194","443","TLSv1.2","1111","Application Data"
"257","2.995365000","124.6.36.194","443","192.168.91.128","49180","TCP","54","443 > 49180 [ACK] Seq=85299 Ack=17029 Win=64240 Len=0"
"266","3.133787000","124.6.36.194","443","192.168.91.128","49180","TLSv1.2","597","Application Data"
"267","3.134518000","192.168.91.128","49180","124.6.36.194","443","TLSv1.2","1111","Application Data"
"268","3.134568000","124.6.36.194","443","192.168.91.128","49180","TCP","54","443 > 49180 [ACK] Seq=85842 Ack=18086 Win=64240 Len=0"
"281","3.428342000","124.6.36.194","443","192.168.91.128","49180","TLSv1.2","597","Application Data"
"282","3.429459000","192.168.91.128","49180","124.6.36.194","443","TLSv1.2","1111","Application Data"
"283","3.429520000","124.6.36.194","443","192.168.91.128","49180","TCP","54","443 > 49180 [ACK] Seq=86385 Ack=19143 Win=64240 Len=0"
"284","3.430042000","192.168.91.128","49180","124.6.36.194","443","TLSv1.2","1111","Application Data"
"285","3.430083000","124.6.36.194","443","192.168.91.128","49180","TCP","54","443 > 49180 [ACK] Seq=86385 Ack=20200 Win=64240 Len=0"
"290","3.526245000","124.6.36.194","443","192.168.91.128","49180","TLSv1.2","1514","Application Data"
"291","3.527596000","124.6.36.194","443","192.168.91.128","49180","TLSv1.2","194","Application Data"
"292","3.527717000","192.168.91.128","49180","124.6.36.194","443","TCP","54","49180 > 443 [ACK] Seq=20200 Ack=87985 Win=64240 Len=0"
"301","3.757140000","124.6.36.194","443","192.168.91.128","49180","TLSv1.2","597","Application Data"
"302","3.770930000","192.168.91.128","49180","124.6.36.194","443","TCP","54","49180 > 443 [ACK] Seq=20200 Ack=88528 Win=63697 Len=0"
"307","3.850610000","124.6.36.194","443","192.168.91.128","49180","TLSv1.2","1514","Application Data, Application Data"
"308","3.850633000","124.6.36.194","443","192.168.91.128","49180","TCP","1514","[TCP segment of a reassembled PDU]"
"309","3.850751000","192.168.91.128","49180","124.6.36.194","443","TCP","54","49180 > 443 [ACK] Seq=20200 Ack=91448 Win=64240 Len=0"
"310","3.866854000","124.6.36.194","443","192.168.91.128","49180","TLSv1.2","1514","Application Data"
"311","3.877615000","192.168.91.128","49180","124.6.36.194","443","TCP","54","49180 > 443 [ACK] Seq=20200 Ack=92908 Win=64240 Len=0"
"312","3.905192000","124.6.36.194","443","192.168.91.128","49180","TLSv1.2","416","Application Data"
"313","3.908840000","192.168.91.128","49180","124.6.36.194","443","TLSv1.2","597","Application Data"
"314","3.908900000","124.6.36.194","443","192.168.91.128","49180","TCP","54","443 > 49180 [ACK] Seq=93270 Ack=20743 Win=64240 Len=0"
"315","3.909071000","192.168.91.128","49180","124.6.36.194","443","TLSv1.2","597","Application Data"
"316","3.909119000","124.6.36.194","443","192.168.91.128","49180","TCP","54","443 > 49180 [ACK] Seq=93270 Ack=21286 Win=64240 Len=0"
"329","4.129728000","124.6.36.194","443","192.168.91.128","49180","TLSv1.2","597","Application Data"
"330","4.140033000","192.168.91.128","49180","124.6.36.194","443","TCP","54","49180 > 443 [ACK] Seq=21286 Ack=93813 Win=63335 Len=0"
"335","4.278632000","124.6.36.194","443","192.168.91.128","49180","TLSv1.2","1140","Application Data, Application Data"
"336","4.288882000","192.168.91.128","49180","124.6.36.194","443","TCP","54","49180 > 443 [ACK] Seq=21286 Ack=94899 Win=64240 Len=0"
"337","4.305355000","192.168.91.128","49180","124.6.36.194","443","TLSv1.2","1111","Application Data"
"338","4.305413000","124.6.36.194","443","192.168.91.128","49180","TCP","54","443 > 49180 [ACK] Seq=94899 Ack=22343 Win=64240 Len=0"
"355","4.691188000","192.168.91.128","49180","124.6.36.194","443","TLSv1.2","597","Application Data"
"356","4.691238000","124.6.36.194","443","192.168.91.128","49180","TCP","54","443 > 49180 [ACK] Seq=94899 Ack=22886 Win=64240 Len=0"
"365","4.841812000","192.168.91.128","49180","124.6.36.194","443","TLSv1.2","597","Application Data"
"366","4.841869000","124.6.36.194","443","192.168.91.128","49180","TCP","54","443 > 49180 [ACK] Seq=94899 Ack=23429 Win=64240 Len=0"
"367","4.842000000","192.168.91.128","49180","124.6.36.194","443","TLSv1.2","597","Application Data"
"368","4.842010000","124.6.36.194","443","192.168.91.128","49180","TCP","54","443 > 49180 [ACK] Seq=94899 Ack=23972 Win=64240 Len=0"
"369","4.849936000","124.6.36.194","443","192.168.91.128","49180","TLSv1.2","597","Application Data"
"370","4.852068000","192.168.91.128","49180","124.6.36.194","443","TCP","54","49180 > 443 [ACK] Seq=23972 Ack=95442 Win=63697 Len=0"
"371","4.897073000","192.168.91.128","49180","124.6.36.194","443","TLSv1.2","1111","Application Data"
"372","4.897118000","124.6.36.194","443","192.168.91.128","49180","TCP","54","443 > 49180 [ACK] Seq=95442 Ack=25029 Win=64240 Len=0"
"377","4.927065000","124.6.36.194","443","192.168.91.128","49180","TLSv1.2","1514","Application Data"
"378","4.938043000","192.168.91.128","49180","124.6.36.194","443","TCP","54","49180 > 443 [ACK] Seq=25029 Ack=96902 Win=64240 Len=0"
"379","4.947537000","124.6.36.194","443","192.168.91.128","49180","TLSv1.2","194","Application Data"
"380","4.957871000","192.168.91.128","49180","124.6.36.194","443","TCP","1514","[TCP segment of a reassembled PDU]"
"381","4.957889000","192.168.91.128","49180","124.6.36.194","443","TLSv1.2","165","Application Data"
"382","4.957932000","124.6.36.194","443","192.168.91.128","49180","TCP","54","443 > 49180 [ACK] Seq=97042 Ack=26489 Win=64240 Len=0"
"383","4.957951000","124.6.36.194","443","192.168.91.128","49180","TCP","54","443 > 49180 [ACK] Seq=97042 Ack=26600 Win=64240 Len=0"
"388","5.028592000","124.6.36.194","443","192.168.91.128","49180","TLSv1.2","1514","Application Data, Application Data"
"389","5.028658000","124.6.36.194","443","192.168.91.128","49180","TCP","1514","[TCP segment of a reassembled PDU]"
"390","5.028758000","192.168.91.128","49180","124.6.36.194","443","TCP","54","49180 > 443 [ACK] Seq=26600 Ack=99962 Win=64240 Len=0"
"391","5.039176000","124.6.36.194","443","192.168.91.128","49180","TLSv1.2","1514","Application Data"
"392","5.049430000","192.168.91.128","49180","124.6.36.194","443","TCP","54","49180 > 443 [ACK] Seq=26600 Ack=101422 Win=64240 Len=0"
"393","5.056162000","124.6.36.194","443","192.168.91.128","49180","TLSv1.2","416","Application Data"
"394","5.059170000","192.168.91.128","49180","124.6.36.194","443","TLSv1.2","597","Application Data"
"395","5.059212000","124.6.36.194","443","192.168.91.128","49180","TCP","54","443 > 49180 [ACK] Seq=101784 Ack=27143 Win=64240 Len=0"
"400","5.147234000","124.6.36.194","443","192.168.91.128","49180","TLSv1.2","1514","Application Data, Application Data"
"401","5.147258000","124.6.36.194","443","192.168.91.128","49180","TCP","1514","[TCP segment of a reassembled PDU]"
"402","5.147354000","192.168.91.128","49180","124.6.36.194","443","TCP","54","49180 > 443 [ACK] Seq=27143 Ack=104704 Win=64240 Len=0"
"403","5.204595000","124.6.36.194","443","192.168.91.128","49180","TLSv1.2","1333","Application Data"
"408","5.217835000","192.168.91.128","49180","124.6.36.194","443","TCP","54","49180 > 443 [ACK] Seq=27143 Ack=105983 Win=62961 Len=0"
"409","5.263054000","124.6.36.194","443","192.168.91.128","49180","TLSv1.2","1514","Application Data, Application Data"
"410","5.266744000","192.168.91.128","49180","124.6.36.194","443","TLSv1.2","597","Application Data"
"411","5.266811000","124.6.36.194","443","192.168.91.128","49180","TCP","54","443 > 49180 [ACK] Seq=107443 Ack=27686 Win=64240 Len=0"
"416","5.351898000","124.6.36.194","443","192.168.91.128","49180","TLSv1.2","766","Application Data"
"417","5.362574000","192.168.91.128","49180","124.6.36.194","443","TCP","54","49180 > 443 [ACK] Seq=27686 Ack=108155 Win=63528 Len=0"
"422","5.500551000","124.6.36.194","443","192.168.91.128","49180","TLSv1.2","597","Application Data"
"423","5.510882000","192.168.91.128","49180","124.6.36.194","443","TCP","54","49180 > 443 [ACK] Seq=27686 Ack=108698 Win=62985 Len=0"
"444","5.964288000","192.168.91.128","49180","124.6.36.194","443","TLSv1.2","597","Application Data"
"445","5.964395000","124.6.36.194","443","192.168.91.128","49180","TCP","54","443 > 49180 [ACK] Seq=108698 Ack=28229 Win=64240 Len=0"
"454","6.191029000","124.6.36.194","443","192.168.91.128","49180","TLSv1.2","597","Application Data"
"455","6.202265000","192.168.91.128","49180","124.6.36.194","443","TCP","54","49180 > 443 [ACK] Seq=28229 Ack=109241 Win=64240 Len=0"
"484","6.849744000","192.168.91.128","49180","124.6.36.194","443","TLSv1.2","1111","Application Data"
"485","6.849807000","124.6.36.194","443","192.168.91.128","49180","TCP","54","443 > 49180 [ACK] Seq=109241 Ack=29286 Win=64240 Len=0"
"486","6.850415000","192.168.91.128","49180","124.6.36.194","443","TLSv1.2","1111","Application Data"
"487","6.850459000","124.6.36.194","443","192.168.91.128","49180","TCP","54","443 > 49180 [ACK] Seq=109241 Ack=30343 Win=64240 Len=0"
"496","7.111817000","124.6.36.194","443","192.168.91.128","49180","TLSv1.2","597","Application Data"
"501","7.122096000","192.168.91.128","49180","124.6.36.194","443","TCP","54","49180 > 443 [ACK] Seq=30343 Ack=109784 Win=63697 Len=0"
"506","7.260521000","124.6.36.194","443","192.168.91.128","49180","TLSv1.2","597","Application Data"
"507","7.269890000","192.168.91.128","49180","124.6.36.194","443","TCP","54","49180 > 443 [ACK] Seq=30343 Ack=110327 Win=63154 Len=0"
"572","8.850903000","192.168.91.128","49180","124.6.36.194","443","TLSv1.2","1111","Application Data"
"573","8.850972000","124.6.36.194","443","192.168.91.128","49180","TCP","54","443 > 49180 [ACK] Seq=110327 Ack=31400 Win=64240 Len=0"
"582","9.087493000","124.6.36.194","443","192.168.91.128","49180","TLSv1.2","597","Application Data"
"583","9.097857000","192.168.91.128","49180","124.6.36.194","443","TCP","54","49180 > 443 [ACK] Seq=31400 Ack=110870 Win=64240 Len=0"
"616","9.852360000","192.168.91.128","49180","124.6.36.194","443","TLSv1.2","1111","Application Data"
"617","9.852423000","124.6.36.194","443","192.168.91.128","49180","TCP","54","443 > 49180 [ACK] Seq=110870 Ack=32457 Win=64240 Len=0"
"626","10.042100000","124.6.36.194","443","192.168.91.128","49180","TLSv1.2","597","Application Data"
"631","10.131185000","192.168.91.128","49180","124.6.36.194","443","TCP","54","49180 > 443 [ACK] Seq=32457 Ack=111413 Win=63697 Len=0"
"648","10.537033000","192.168.91.128","49180","124.6.36.194","443","TLSv1.2","1111","Application Data"
"649","10.537109000","124.6.36.194","443","192.168.91.128","49180","TCP","54","443 > 49180 [ACK] Seq=111413 Ack=33514 Win=64240 Len=0"
"654","10.684455000","192.168.91.128","49180","124.6.36.194","443","TLSv1.2","1111","Application Data"
"655","10.684456000","124.6.36.194","443","192.168.91.128","49180","TCP","54","443 > 49180 [ACK] Seq=111413 Ack=34571 Win=64240 Len=0"
"660","10.811276000","124.6.36.194","443","192.168.91.128","49180","TLSv1.2","597","Application Data"
"661","10.823802000","192.168.91.128","49180","124.6.36.194","443","TCP","54","49180 > 443 [ACK] Seq=34571 Ack=111956 Win=63154 Len=0"
"666","10.847072000","124.6.36.194","443","192.168.91.128","49180","TLSv1.2","1514","Application Data, Application Data"
"667","10.847209000","124.6.36.194","443","192.168.91.128","49180","TLSv1.2","1514","Application Data"
"668","10.847210000","124.6.36.194","443","192.168.91.128","49180","TCP","1514","[TCP segment of a reassembled PDU]"
"669","10.847330000","192.168.91.128","49180","124.6.36.194","443","TCP","54","49180 > 443 [ACK] Seq=34571 Ack=116336 Win=64240 Len=0"
"670","10.852516000","192.168.91.128","49180","124.6.36.194","443","TLSv1.2","1111","Application Data"
"671","10.852518000","124.6.36.194","443","192.168.91.128","49180","TCP","54","443 > 49180 [ACK] Seq=116336 Ack=35628 Win=64240 Len=0"
"672","10.852518000","124.6.36.194","443","192.168.91.128","49180","TLSv1.2","1514","Application Data"
"673","10.854013000","192.168.91.128","49180","124.6.36.194","443","TLSv1.2","597","Application Data"
"674","10.854013000","124.6.36.194","443","192.168.91.128","49180","TCP","54","443 > 49180 [ACK] Seq=117796 Ack=36171 Win=64240 Len=0"
"679","10.944841000","124.6.36.194","443","192.168.91.128","49180","TLSv1.2","1099","Application Data"
"680","10.948445000","192.168.91.128","49180","124.6.36.194","443","TLSv1.2","597","Application Data"
"681","10.948445000","124.6.36.194","443","192.168.91.128","49180","TCP","54","443 > 49180 [ACK] Seq=118841 Ack=36714 Win=64240 Len=0"
"682","10.948650000","192.168.91.128","49180","124.6.36.194","443","TLSv1.2","1111","Application Data"
"683","10.948657000","124.6.36.194","443","192.168.91.128","49180","TCP","54","443 > 49180 [ACK] Seq=118841 Ack=37771 Win=64240 Len=0"
"688","11.042780000","124.6.36.194","443","192.168.91.128","49180","TLSv1.2","597","Application Data"
"689","11.059300000","192.168.91.128","49180","124.6.36.194","443","TCP","54","49180 > 443 [ACK] Seq=37771 Ack=119384 Win=64240 Len=0"
"690","11.118412000","124.6.36.194","443","192.168.91.128","49180","TLSv1.2","1514","Application Data, Application Data"
"691","11.118413000","124.6.36.194","443","192.168.91.128","49180","TCP","1514","[TCP segment of a reassembled PDU]"
"692","11.118672000","192.168.91.128","49180","124.6.36.194","443","TCP","54","49180 > 443 [ACK] Seq=37771 Ack=122304 Win=64240 Len=0"
"697","11.133433000","124.6.36.194","443","192.168.91.128","49180","TLSv1.2","1514","Application Data"
"698","11.133810000","124.6.36.194","443","192.168.91.128","49180","TLSv1.2","1514","Application Data"
"699","11.133811000","124.6.36.194","443","192.168.91.128","49180","TCP","1514","[TCP segment of a reassembled PDU]"
"700","11.133812000","124.6.36.194","443","192.168.91.128","49180","TLSv1.2","1514","Application Data"
"701","11.133812000","124.6.36.194","443","192.168.91.128","49180","TCP","1514","[TCP segment of a reassembled PDU]"
"702","11.133813000","124.6.36.194","443","192.168.91.128","49180","TCP","1514","[TCP segment of a reassembled PDU]"
"703","11.133813000","124.6.36.194","443","192.168.91.128","49180","TLSv1.2","1514","Application Data"
"704","11.134063000","192.168.91.128","49180","124.6.36.194","443","TCP","54","49180 > 443 [ACK] Seq=37771 Ack=132524 Win=64240 Len=0"
"705","11.191675000","124.6.36.194","443","192.168.91.128","49180","TLSv1.2","1514","Application Data"
"706","11.191676000","124.6.36.194","443","192.168.91.128","49180","TLSv1.2","1514","Application Data"
"707","11.191863000","192.168.91.128","49180","124.6.36.194","443","TCP","54","49180 > 443 [ACK] Seq=37771 Ack=135444 Win=64240 Len=0"
"708","11.216414000","124.6.36.194","443","192.168.91.128","49180","TLSv1.2","1514","Application Data"
"709","11.216415000","124.6.36.194","443","192.168.91.128","49180","TCP","1514","[TCP segment of a reassembled PDU]"
"710","11.216415000","124.6.36.194","443","192.168.91.128","49180","TLSv1.2","1514","Application Data"
"711","11.216698000","192.168.91.128","49180","124.6.36.194","443","TCP","54","49180 > 443 [ACK] Seq=37771 Ack=139824 Win=64240 Len=0"
"712","11.216981000","192.168.91.128","49180","124.6.36.194","443","TLSv1.2","597","Application Data"
"713","11.216981000","124.6.36.194","443","192.168.91.128","49180","TCP","54","443 > 49180 [ACK] Seq=139824 Ack=38314 Win=64240 Len=0"
"718","11.233076000","124.6.36.194","443","192.168.91.128","49180","TLSv1.2","1514","Application Data"
"719","11.233077000","124.6.36.194","443","192.168.91.128","49180","TCP","1514","[TCP segment of a reassembled PDU]"
"720","11.233078000","124.6.36.194","443","192.168.91.128","49180","TLSv1.2","1514","Application Data"
"721","11.233079000","124.6.36.194","443","192.168.91.128","49180","TCP","1514","[TCP segment of a reassembled PDU]"
"722","11.233080000","124.6.36.194","443","192.168.91.128","49180","TLSv1.2","1514","Application Data"
"723","11.233080000","124.6.36.194","443","192.168.91.128","49180","TLSv1.2","1514","Application Data"
"724","11.235015000","124.6.36.194","443","192.168.91.128","49180","TCP","1514","[TCP segment of a reassembled PDU]"
"725","11.235016000","124.6.36.194","443","192.168.91.128","49180","TCP","1514","[TCP segment of a reassembled PDU]"
"726","11.235016000","192.168.91.128","49180","124.6.36.194","443","TCP","54","49180 > 443 [ACK] Seq=38314 Ack=151504 Win=64240 Len=0"
"727","11.289608000","124.6.36.194","443","192.168.91.128","49180","TLSv1.2","1514","Application Data"
"728","11.289609000","124.6.36.194","443","192.168.91.128","49180","TCP","1514","[TCP segment of a reassembled PDU]"
"729","11.289610000","124.6.36.194","443","192.168.91.128","49180","TLSv1.2","1514","Application Data"
"730","11.289826000","192.168.91.128","49180","124.6.36.194","443","TCP","54","49180 > 443 [ACK] Seq=38314 Ack=155884 Win=64240 Len=0"
"731","11.314336000","124.6.36.194","443","192.168.91.128","49180","TLSv1.2","1514","Application Data"
"732","11.314337000","124.6.36.194","443","192.168.91.128","49180","TCP","1514","[TCP segment of a reassembled PDU]"
"733","11.314337000","124.6.36.194","443","192.168.91.128","49180","TLSv1.2","1514","Application Data"
"734","11.314474000","192.168.91.128","49180","124.6.36.194","443","TCP","54","49180 > 443 [ACK] Seq=38314 Ack=160264 Win=64240 Len=0"
"735","11.315150000","124.6.36.194","443","192.168.91.128","49180","TCP","1514","[TCP segment of a reassembled PDU]"
"736","11.315771000","192.168.91.128","49180","124.6.36.194","443","TCP","54","49180 > 443 [ACK] Seq=38314 Ack=161724 Win=64240 Len=0"
"737","11.315946000","124.6.36.194","443","192.168.91.128","49180","TCP","1514","[TCP segment of a reassembled PDU]"
"738","11.329675000","192.168.91.128","49180","124.6.36.194","443","TCP","54","49180 > 443 [ACK] Seq=38314 Ack=163184 Win=64240 Len=0"
"743","11.330217000","124.6.36.194","443","192.168.91.128","49180","TLSv1.2","1514","Application Data"
"744","11.330217000","124.6.36.194","443","192.168.91.128","49180","TLSv1.2","1514","Application Data"
"745","11.330217000","124.6.36.194","443","192.168.91.128","49180","TCP","1514","[TCP segment of a reassembled PDU]"
"746","11.330219000","124.6.36.194","443","192.168.91.128","49180","TCP","1514","[TCP segment of a reassembled PDU]"
"747","11.330219000","124.6.36.194","443","192.168.91.128","49180","TLSv1.2","1514","Application Data"
"748","11.330219000","124.6.36.194","443","192.168.91.128","49180","TCP","1514","[TCP segment of a reassembled PDU]"
"749","11.330495000","192.168.91.128","49180","124.6.36.194","443","TCP","54","49180 > 443 [ACK] Seq=38314 Ack=171944 Win=64240 Len=0"
"750","11.330548000","124.6.36.194","443","192.168.91.128","49180","TLSv1.2","1514","Application Data"
"751","11.331469000","192.168.91.128","49180","124.6.36.194","443","TLSv1.2","597","Application Data"
"752","11.331469000","124.6.36.194","443","192.168.91.128","49180","TCP","54","443 > 49180 [ACK] Seq=173404 Ack=38857 Win=64240 Len=0"
"753","11.331470000","192.168.91.128","49180","124.6.36.194","443","TLSv1.2","597","Application Data"
"754","11.331470000","124.6.36.194","443","192.168.91.128","49180","TCP","54","443 > 49180 [ACK] Seq=173404 Ack=39400 Win=64240 Len=0"
"755","11.331545000","124.6.36.194","443","192.168.91.128","49180","TLSv1.2","1514","Application Data"
"756","11.331546000","124.6.36.194","443","192.168.91.128","49180","TCP","1514","[TCP segment of a reassembled PDU]"
"757","11.331546000","124.6.36.194","443","192.168.91.128","49180","TLSv1.2","1514","Application Data"
"758","11.331756000","192.168.91.128","49180","124.6.36.194","443","TCP","54","49180 > 443 [ACK] Seq=39400 Ack=177784 Win=64240 Len=0"
"759","11.387740000","124.6.36.194","443","192.168.91.128","49180","TLSv1.2","1514","Application Data"
"760","11.387749000","124.6.36.194","443","192.168.91.128","49180","TCP","1514","[TCP segment of a reassembled PDU]"
"761","11.387749000","124.6.36.194","443","192.168.91.128","49180","TLSv1.2","1514","Application Data"
"762","11.387945000","192.168.91.128","49180","124.6.36.194","443","TCP","54","49180 > 443 [ACK] Seq=39400 Ack=182164 Win=64240 Len=0"
"763","11.413244000","124.6.36.194","443","192.168.91.128","49180","TLSv1.2","1514","Application Data"
"764","11.413245000","124.6.36.194","443","192.168.91.128","49180","TLSv1.2","1514","Application Data"
"765","11.413245000","124.6.36.194","443","192.168.91.128","49180","TCP","1514","[TCP segment of a reassembled PDU]"
"766","11.413246000","124.6.36.194","443","192.168.91.128","49180","TLSv1.2","1514","Application Data"
"767","11.413246000","124.6.36.194","443","192.168.91.128","49180","TLSv1.2","1514","Application Data"
"768","11.413247000","124.6.36.194","443","192.168.91.128","49180","TCP","1514","[TCP segment of a reassembled PDU]"
"769","11.413987000","192.168.91.128","49180","124.6.36.194","443","TCP","54","49180 > 443 [ACK] Seq=39400 Ack=190924 Win=64240 Len=0"
"770","11.413987000","124.6.36.194","443","192.168.91.128","49180","TLSv1.2","1514","Application Data"
"771","11.413988000","124.6.36.194","443","192.168.91.128","49180","TCP","1514","[TCP segment of a reassembled PDU]"
"772","11.413988000","124.6.36.194","443","192.168.91.128","49180","TLSv1.2","1514","Application Data"
"773","11.415507000","192.168.91.128","49180","124.6.36.194","443","TCP","54","49180 > 443 [ACK] Seq=39400 Ack=195304 Win=64240 Len=0"
"774","11.415508000","192.168.91.128","49180","124.6.36.194","443","TLSv1.2","597","Application Data"
"775","11.415508000","124.6.36.194","443","192.168.91.128","49180","TCP","54","443 > 49180 [ACK] Seq=195304 Ack=39943 Win=64240 Len=0"
"776","11.428290000","124.6.36.194","443","192.168.91.128","49180","TCP","1514","[TCP segment of a reassembled PDU]"
"777","11.428290000","124.6.36.194","443","192.168.91.128","49180","TCP","1514","[TCP segment of a reassembled PDU]"
"778","11.428291000","124.6.36.194","443","192.168.91.128","49180","TLSv1.2","1514","Application Data"
"779","11.428293000","124.6.36.194","443","192.168.91.128","49180","TCP","1514","[TCP segment of a reassembled PDU]"
"780","11.428294000","124.6.36.194","443","192.168.91.128","49180","TLSv1.2","1514","Application Data"
"781","11.428294000","124.6.36.194","443","192.168.91.128","49180","TLSv1.2","1514","Application Data"
"782","11.428295000","124.6.36.194","443","192.168.91.128","49180","TLSv1.2","1514","Application Data"
"783","11.428558000","192.168.91.128","49180","124.6.36.194","443","TCP","54","49180 > 443 [ACK] Seq=39943 Ack=205524 Win=64240 Len=0"
"784","11.428558000","124.6.36.194","443","192.168.91.128","49180","TCP","1514","[TCP segment of a reassembled PDU]"
"785","11.428558000","192.168.91.128","49180","124.6.36.194","443","TCP","54","49180 > 443 [ACK] Seq=39943 Ack=206984 Win=64240 Len=0"
"786","11.429769000","124.6.36.194","443","192.168.91.128","49180","TLSv1.2","1514","Application Data"
"787","11.429770000","124.6.36.194","443","192.168.91.128","49180","TCP","1514","[TCP segment of a reassembled PDU]"
"788","11.429770000","192.168.91.128","49180","124.6.36.194","443","TCP","54","49180 > 443 [ACK] Seq=39943 Ack=209904 Win=64240 Len=0"
"789","11.430183000","124.6.36.194","443","192.168.91.128","49180","TLSv1.2","1514","Application Data"
"790","11.430184000","124.6.36.194","443","192.168.91.128","49180","TLSv1.2","1514","Application Data"
"791","11.430184000","124.6.36.194","443","192.168.91.128","49180","TCP","1514","[TCP segment of a reassembled PDU]"
"792","11.430185000","124.6.36.194","443","192.168.91.128","49180","TLSv1.2","1514","Application Data"
"793","11.430185000","192.168.91.128","49180","124.6.36.194","443","TCP","54","49180 > 443 [ACK] Seq=39943 Ack=215744 Win=64240 Len=0"
"798","11.486144000","124.6.36.194","443","192.168.91.128","49180","TLSv1.2","1514","Application Data"
"799","11.486145000","124.6.36.194","443","192.168.91.128","49180","TLSv1.2","1514","Application Data"
"800","11.486145000","124.6.36.194","443","192.168.91.128","49180","TCP","1514","[TCP segment of a reassembled PDU]"
