Packet capture with prefetch disabled
URL: http://www-users.cs.umn.edu/~vaibhav/no-prefetch-test.html
Local machine IP: 10.104.162.227
Tor Entry Guard IP: 192.99.111.11

"No.","Time","Source","Destination","Protocol","Length","Info","Destination Port","Src Port"
"56","0.800029000","10.104.162.227","192.99.111.11","TCP","1123","55894 > 9001 [PSH, ACK] Seq=1 Ack=1 Win=8192 Len=1057 TSval=1468844157 TSecr=3420872413","9001","55894"
"80","1.122855000","192.99.111.11","10.104.162.227","TCP","609","9001 > 55894 [PSH, ACK] Seq=1 Ack=1058 Win=536 Len=543 TSval=3420886312 TSecr=1468844157","55894","9001"
"95","1.251118000","192.99.111.11","10.104.162.227","TCP","609","9001 > 55894 [PSH, ACK] Seq=544 Ack=1058 Win=536 Len=543 TSval=3420886440 TSecr=1468844477","55894","9001"
"97","1.307611000","192.99.111.11","10.104.162.227","TCP","609","9001 > 55894 [PSH, ACK] Seq=1087 Ack=1058 Win=536 Len=543 TSval=3420886496 TSecr=1468844604","55894","9001"
"124","1.818030000","209.85.145.125","10.104.162.227","TCP","439","5223 > 54885 [PSH, ACK] Seq=1 Ack=1 Win=1653 Len=373 TSval=3555888170 TSecr=1468842937","54885","5223"
"126","1.818948000","10.104.162.227","209.85.145.125","TCP","215","54885 > 5223 [PSH, ACK] Seq=1 Ack=374 Win=8564 Len=149 TSval=1468845169 TSecr=3555888170","5223","54885"
"134","1.912973000","209.85.145.125","10.104.162.227","TCP","1479","5223 > 54885 [PSH, ACK] Seq=374 Ack=150 Win=1653 Len=1413 TSval=3555888269 TSecr=1468845169","54885","5223"
"135","1.912981000","209.85.145.125","10.104.162.227","TCP","487","5223 > 54885 [PSH, ACK] Seq=1787 Ack=150 Win=1653 Len=421 TSval=3555888269 TSecr=1468845169","54885","5223"
"138","1.915522000","209.85.145.125","10.104.162.227","TCP","1479","5223 > 54885 [PSH, ACK] Seq=2208 Ack=150 Win=1653 Len=1413 TSval=3555888269 TSecr=1468845169","54885","5223"
"139","1.915526000","209.85.145.125","10.104.162.227","TCP","1479","5223 > 54885 [PSH, ACK] Seq=3621 Ack=150 Win=1653 Len=1413 TSval=3555888269 TSecr=1468845169","54885","5223"
"140","1.915527000","209.85.145.125","10.104.162.227","TCP","919","5223 > 54885 [PSH, ACK] Seq=5034 Ack=150 Win=1653 Len=853 TSval=3555888269 TSecr=1468845169","54885","5223"
"141","1.915529000","209.85.145.125","10.104.162.227","TCP","967","5223 > 54885 [PSH, ACK] Seq=5887 Ack=150 Win=1653 Len=901 TSval=3555888269 TSecr=1468845169","54885","5223"
"162","2.049868000","209.85.145.125","10.104.162.227","TCP","439","5223 > 54885 [PSH, ACK] Seq=6788 Ack=150 Win=1653 Len=373 TSval=3555888397 TSecr=1468845265","54885","5223"
"766","6.255561000","192.99.111.11","10.104.162.227","TCP","609","9001 > 55894 [PSH, ACK] Seq=1630 Ack=1058 Win=536 Len=543 TSval=3420891444 TSecr=1468844660","55894","9001"
