Prefetch URL: http://www-users.cs.umn.edu/~vaibhav/prefetch-test.html
Local Machine IP: 10.104.162.227
Tor Entry Guard IP: 192.99.111.11

"No.","Time","Source","Destination","Protocol","Length","Info","Destination Port","Src Port"
"1281","7.118995000","10.104.162.227","192.99.111.11","TCP","1123","55894 > 9001 [PSH, ACK] Seq=1 Ack=1 Win=8192 Len=1057 TSval=1468362975 TSecr=3420395473","9001","55894"
"1324","7.440193000","192.99.111.11","10.104.162.227","TCP","609","9001 > 55894 [PSH, ACK] Seq=1 Ack=1058 Win=536 Len=543 TSval=3420404170 TSecr=1468362975","55894","9001"
"1337","7.558296000","192.99.111.11","10.104.162.227","TCP","609","9001 > 55894 [PSH, ACK] Seq=544 Ack=1058 Win=536 Len=543 TSval=3420404285 TSecr=1468363294","55894","9001"
"1343","7.646528000","192.99.111.11","10.104.162.227","TCP","609","9001 > 55894 [PSH, ACK] Seq=1087 Ack=1058 Win=536 Len=543 TSval=3420404370 TSecr=1468363410","55894","9001"
"1345","7.655682000","10.104.162.227","192.99.111.11","TCP","1123","55894 > 9001 [PSH, ACK] Seq=1058 Ack=1630 Win=8192 Len=1057 TSval=1468363506 TSecr=3420404370","9001","55894"
"1403","7.947199000","192.99.111.11","10.104.162.227","TCP","609","9001 > 55894 [PSH, ACK] Seq=1630 Ack=2115 Win=536 Len=543 TSval=3420404670 TSecr=1468363506","55894","9001"
"1424","8.135234000","192.99.111.11","10.104.162.227","TCP","609","9001 > 55894 [PSH, ACK] Seq=2173 Ack=2115 Win=536 Len=543 TSval=3420404846 TSecr=1468363797","55894","9001"
"1425","8.135238000","192.99.111.11","10.104.162.227","TCP","1514","9001 > 55894 [ACK] Seq=2716 Ack=2115 Win=536 Len=1448 TSval=3420404857 TSecr=1468363797","55894","9001"
"1427","8.150318000","192.99.111.11","10.104.162.227","TCP","1514","9001 > 55894 [ACK] Seq=4164 Ack=2115 Win=536 Len=1448 TSval=3420404862 TSecr=1468363797","55894","9001"
"1428","8.150323000","192.99.111.11","10.104.162.227","TCP","1514","9001 > 55894 [ACK] Seq=5612 Ack=2115 Win=536 Len=1448 TSval=3420404862 TSecr=1468363797","55894","9001"
"1429","8.150353000","192.99.111.11","10.104.162.227","TCP","1514","9001 > 55894 [ACK] Seq=7060 Ack=2115 Win=536 Len=1448 TSval=3420404862 TSecr=1468363797","55894","9001"
"1430","8.150354000","192.99.111.11","10.104.162.227","TCP","1514","9001 > 55894 [ACK] Seq=8508 Ack=2115 Win=536 Len=1448 TSval=3420404862 TSecr=1468363797","55894","9001"
"1434","8.151152000","10.104.162.227","192.99.111.11","TCP","609","55894 > 9001 [PSH, ACK] Seq=2115 Ack=9956 Win=8192 Len=543 TSval=1468363999 TSecr=3420404862","9001","55894"
"1435","8.178464000","192.99.111.11","10.104.162.227","TCP","1224","9001 > 55894 [PSH, ACK] Seq=9956 Ack=2115 Win=536 Len=1158 TSval=3420404902 TSecr=1468363984","55894","9001"
"1458","8.203866000","192.99.111.11","10.104.162.227","TCP","1514","9001 > 55894 [ACK] Seq=11114 Ack=2115 Win=536 Len=1448 TSval=3420404907 TSecr=1468363984","55894","9001"
"1459","8.203876000","192.99.111.11","10.104.162.227","TCP","1514","9001 > 55894 [ACK] Seq=12562 Ack=2115 Win=536 Len=1448 TSval=3420404907 TSecr=1468363984","55894","9001"
"1461","8.203963000","192.99.111.11","10.104.162.227","TCP","1514","9001 > 55894 [ACK] Seq=14010 Ack=2658 Win=536 Len=1448 TSval=3420404921 TSecr=1468363999","55894","9001"
"1462","8.203988000","192.99.111.11","10.104.162.227","TCP","1514","9001 > 55894 [ACK] Seq=15458 Ack=2658 Win=536 Len=1448 TSval=3420404921 TSecr=1468363999","55894","9001"
"1465","8.204146000","192.99.111.11","10.104.162.227","TCP","1514","9001 > 55894 [ACK] Seq=16906 Ack=2658 Win=536 Len=1448 TSval=3420404922 TSecr=1468363999","55894","9001"
"1468","8.207699000","192.99.111.11","10.104.162.227","TCP","1514","9001 > 55894 [ACK] Seq=18354 Ack=2658 Win=536 Len=1448 TSval=3420404922 TSecr=1468363999","55894","9001"
"1469","8.207705000","192.99.111.11","10.104.162.227","TCP","1514","9001 > 55894 [ACK] Seq=19802 Ack=2658 Win=536 Len=1448 TSval=3420404922 TSecr=1468363999","55894","9001"
"1470","8.207733000","192.99.111.11","10.104.162.227","TCP","1514","9001 > 55894 [ACK] Seq=21250 Ack=2658 Win=536 Len=1448 TSval=3420404927 TSecr=1468363999","55894","9001"
"1472","8.207930000","192.99.111.11","10.104.162.227","TCP","1514","9001 > 55894 [ACK] Seq=22698 Ack=2658 Win=536 Len=1448 TSval=3420404928 TSecr=1468363999","55894","9001"
"1474","8.210595000","192.99.111.11","10.104.162.227","TCP","1514","9001 > 55894 [ACK] Seq=24146 Ack=2658 Win=536 Len=1448 TSval=3420404935 TSecr=1468363999","55894","9001"
"1476","8.213080000","192.99.111.11","10.104.162.227","TCP","1514","9001 > 55894 [ACK] Seq=25594 Ack=2658 Win=536 Len=1448 TSval=3420404942 TSecr=1468364027","55894","9001"
"1477","8.213085000","192.99.111.11","10.104.162.227","TCP","1021","9001 > 55894 [PSH, ACK] Seq=27042 Ack=2658 Win=536 Len=955 TSval=3420404942 TSecr=1468364027","55894","9001"
"1479","8.254017000","192.99.111.11","10.104.162.227","TCP","1514","9001 > 55894 [ACK] Seq=27997 Ack=2658 Win=536 Len=1448 TSval=3420404966 TSecr=1468364052","55894","9001"
"1480","8.254025000","192.99.111.11","10.104.162.227","TCP","1514","9001 > 55894 [ACK] Seq=29445 Ack=2658 Win=536 Len=1448 TSval=3420404966 TSecr=1468364052","55894","9001"
"1481","8.254067000","192.99.111.11","10.104.162.227","TCP","1514","9001 > 55894 [ACK] Seq=30893 Ack=2658 Win=536 Len=1448 TSval=3420404966 TSecr=1468364052","55894","9001"
"1482","8.254143000","192.99.111.11","10.104.162.227","TCP","1514","9001 > 55894 [ACK] Seq=32341 Ack=2658 Win=536 Len=1448 TSval=3420404967 TSecr=1468364052","55894","9001"
"1485","8.254315000","192.99.111.11","10.104.162.227","TCP","1514","9001 > 55894 [ACK] Seq=33789 Ack=2658 Win=536 Len=1448 TSval=3420404967 TSecr=1468364052","55894","9001"
"1488","8.259729000","192.99.111.11","10.104.162.227","TCP","1514","9001 > 55894 [ACK] Seq=35237 Ack=2658 Win=536 Len=1448 TSval=3420404967 TSecr=1468364052","55894","9001"
"1489","8.259733000","192.99.111.11","10.104.162.227","TCP","1514","9001 > 55894 [ACK] Seq=36685 Ack=2658 Win=536 Len=1448 TSval=3420404967 TSecr=1468364052","55894","9001"
"1490","8.259734000","192.99.111.11","10.104.162.227","TCP","956","9001 > 55894 [PSH, ACK] Seq=38133 Ack=2658 Win=536 Len=890 TSval=3420404975 TSecr=1468364059","55894","9001"
"1491","8.259735000","192.99.111.11","10.104.162.227","TCP","1514","9001 > 55894 [ACK] Seq=39023 Ack=2658 Win=536 Len=1448 TSval=3420404978 TSecr=1468364059","55894","9001"
"1492","8.259795000","192.99.111.11","10.104.162.227","TCP","1514","9001 > 55894 [ACK] Seq=40471 Ack=2658 Win=536 Len=1448 TSval=3420404978 TSecr=1468364059","55894","9001"
"1496","8.259977000","192.99.111.11","10.104.162.227","TCP","1514","9001 > 55894 [ACK] Seq=41919 Ack=2658 Win=536 Len=1448 TSval=3420404978 TSecr=1468364059","55894","9001"
"1503","8.308097000","192.99.111.11","10.104.162.227","TCP","435","9001 > 55894 [PSH, ACK] Seq=43367 Ack=2658 Win=536 Len=369 TSval=3420405022 TSecr=1468364104","55894","9001"
"1505","8.328522000","192.99.111.11","10.104.162.227","TCP","1514","9001 > 55894 [ACK] Seq=43736 Ack=2658 Win=536 Len=1448 TSval=3420405036 TSecr=1468364104","55894","9001"
"1506","8.328526000","192.99.111.11","10.104.162.227","TCP","1514","9001 > 55894 [ACK] Seq=45184 Ack=2658 Win=536 Len=1448 TSval=3420405036 TSecr=1468364104","55894","9001"
"1507","8.328563000","192.99.111.11","10.104.162.227","TCP","1514","9001 > 55894 [ACK] Seq=46632 Ack=2658 Win=536 Len=1448 TSval=3420405037 TSecr=1468364104","55894","9001"
"1508","8.328610000","192.99.111.11","10.104.162.227","TCP","1514","9001 > 55894 [ACK] Seq=48080 Ack=2658 Win=536 Len=1448 TSval=3420405043 TSecr=1468364104","55894","9001"
"1511","8.328720000","192.99.111.11","10.104.162.227","TCP","1514","9001 > 55894 [ACK] Seq=49528 Ack=2658 Win=536 Len=1448 TSval=3420405044 TSecr=1468364104","55894","9001"
"1514","8.343300000","192.99.111.11","10.104.162.227","TCP","1514","9001 > 55894 [ACK] Seq=50976 Ack=2658 Win=536 Len=1448 TSval=3420405049 TSecr=1468364104","55894","9001"
"1515","8.343307000","192.99.111.11","10.104.162.227","TCP","1514","9001 > 55894 [ACK] Seq=52424 Ack=2658 Win=536 Len=1448 TSval=3420405049 TSecr=1468364104","55894","9001"
"1516","8.343440000","192.99.111.11","10.104.162.227","TCP","1514","9001 > 55894 [ACK] Seq=53872 Ack=2658 Win=536 Len=1448 TSval=3420405050 TSecr=1468364104","55894","9001"
"1517","8.343442000","192.99.111.11","10.104.162.227","TCP","1514","9001 > 55894 [ACK] Seq=55320 Ack=2658 Win=536 Len=1448 TSval=3420405050 TSecr=1468364104","55894","9001"
"1520","8.343659000","10.104.162.227","192.99.111.11","TCP","609","55894 > 9001 [PSH, ACK] Seq=2658 Ack=56768 Win=7909 Len=543 TSval=1468364186 TSecr=3420405050","9001","55894"
"1522","8.357644000","192.99.111.11","10.104.162.227","TCP","1514","9001 > 55894 [ACK] Seq=56768 Ack=2658 Win=536 Len=1448 TSval=3420405055 TSecr=1468364104","55894","9001"
"1523","8.357653000","192.99.111.11","10.104.162.227","TCP","1514","9001 > 55894 [ACK] Seq=58216 Ack=2658 Win=536 Len=1448 TSval=3420405055 TSecr=1468364104","55894","9001"
"1524","8.357706000","192.99.111.11","10.104.162.227","TCP","1514","9001 > 55894 [ACK] Seq=59664 Ack=2658 Win=536 Len=1448 TSval=3420405055 TSecr=1468364104","55894","9001"
"1525","8.357721000","192.99.111.11","10.104.162.227","TCP","1514","9001 > 55894 [ACK] Seq=61112 Ack=2658 Win=536 Len=1448 TSval=3420405055 TSecr=1468364104","55894","9001"
"1526","8.357721000","192.99.111.11","10.104.162.227","TCP","1514","9001 > 55894 [ACK] Seq=62560 Ack=2658 Win=536 Len=1448 TSval=3420405057 TSecr=1468364104","55894","9001"
"1529","8.357998000","192.99.111.11","10.104.162.227","TCP","1514","9001 > 55894 [ACK] Seq=64008 Ack=2658 Win=536 Len=1448 TSval=3420405077 TSecr=1468364152","55894","9001"
"1533","8.371061000","192.99.111.11","10.104.162.227","TCP","1514","9001 > 55894 [ACK] Seq=65456 Ack=2658 Win=536 Len=1448 TSval=3420405092 TSecr=1468364172","55894","9001"
"1534","8.371069000","192.99.111.11","10.104.162.227","TCP","1514","9001 > 55894 [ACK] Seq=66904 Ack=2658 Win=536 Len=1448 TSval=3420405092 TSecr=1468364172","55894","9001"
"1535","8.371165000","192.99.111.11","10.104.162.227","TCP","1514","9001 > 55894 [ACK] Seq=68352 Ack=2658 Win=536 Len=1448 TSval=3420405092 TSecr=1468364172","55894","9001"
"1570","8.461203000","192.99.111.11","10.104.162.227","TCP","1514","9001 > 55894 [ACK] Seq=69800 Ack=2658 Win=536 Len=1448 TSval=3420405166 TSecr=1468364172","55894","9001"
"1571","8.461211000","192.99.111.11","10.104.162.227","TCP","1514","9001 > 55894 [ACK] Seq=71248 Ack=2658 Win=536 Len=1448 TSval=3420405166 TSecr=1468364172","55894","9001"
"1572","8.461339000","192.99.111.11","10.104.162.227","TCP","1514","9001 > 55894 [ACK] Seq=72696 Ack=2658 Win=536 Len=1448 TSval=3420405166 TSecr=1468364172","55894","9001"
"1573","8.461340000","192.99.111.11","10.104.162.227","TCP","1514","9001 > 55894 [ACK] Seq=74144 Ack=2658 Win=536 Len=1448 TSval=3420405167 TSecr=1468364186","55894","9001"
"1576","8.461411000","192.99.111.11","10.104.162.227","TCP","1514","9001 > 55894 [ACK] Seq=75592 Ack=2658 Win=536 Len=1448 TSval=3420405167 TSecr=1468364186","55894","9001"
"1579","8.463384000","192.99.111.11","10.104.162.227","TCP","1514","9001 > 55894 [ACK] Seq=77040 Ack=2658 Win=536 Len=1448 TSval=3420405167 TSecr=1468364186","55894","9001"
"1580","8.463389000","192.99.111.11","10.104.162.227","TCP","1514","9001 > 55894 [ACK] Seq=78488 Ack=2658 Win=536 Len=1448 TSval=3420405167 TSecr=1468364186","55894","9001"
"1581","8.463413000","192.99.111.11","10.104.162.227","TCP","1514","9001 > 55894 [ACK] Seq=79936 Ack=2658 Win=536 Len=1448 TSval=3420405167 TSecr=1468364186","55894","9001"
"1583","8.463632000","192.99.111.11","10.104.162.227","TCP","1514","9001 > 55894 [ACK] Seq=81384 Ack=3201 Win=536 Len=1448 TSval=3420405167 TSecr=1468364186","55894","9001"
"1584","8.463667000","192.99.111.11","10.104.162.227","TCP","1514","9001 > 55894 [ACK] Seq=82832 Ack=3201 Win=536 Len=1448 TSval=3420405167 TSecr=1468364186","55894","9001"
"1588","8.464619000","192.99.111.11","10.104.162.227","TCP","1514","9001 > 55894 [ACK] Seq=84280 Ack=3201 Win=536 Len=1448 TSval=3420405167 TSecr=1468364186","55894","9001"
"1589","8.464622000","192.99.111.11","10.104.162.227","TCP","1514","9001 > 55894 [ACK] Seq=85728 Ack=3201 Win=536 Len=1448 TSval=3420405167 TSecr=1468364186","55894","9001"
"1590","8.464769000","192.99.111.11","10.104.162.227","TCP","1514","9001 > 55894 [ACK] Seq=87176 Ack=3201 Win=536 Len=1448 TSval=3420405167 TSecr=1468364200","55894","9001"
"1592","8.464879000","192.99.111.11","10.104.162.227","TCP","1514","9001 > 55894 [ACK] Seq=88624 Ack=3201 Win=536 Len=1448 TSval=3420405167 TSecr=1468364200","55894","9001"
"1593","8.464881000","192.99.111.11","10.104.162.227","TCP","976","9001 > 55894 [PSH, ACK] Seq=90072 Ack=3201 Win=536 Len=910 TSval=3420405167 TSecr=1468364200","55894","9001"
"1596","8.465044000","192.99.111.11","10.104.162.227","TCP","1514","9001 > 55894 [ACK] Seq=90982 Ack=3201 Win=536 Len=1448 TSval=3420405167 TSecr=1468364213","55894","9001"
"1598","8.483093000","192.99.111.11","10.104.162.227","TCP","1514","9001 > 55894 [ACK] Seq=92430 Ack=3201 Win=536 Len=1448 TSval=3420405167 TSecr=1468364213","55894","9001"
"1599","8.483126000","192.99.111.11","10.104.162.227","TCP","1514","9001 > 55894 [ACK] Seq=93878 Ack=3201 Win=536 Len=1448 TSval=3420405167 TSecr=1468364213","55894","9001"
"1631","8.506246000","192.99.111.11","10.104.162.227","TCP","1514","9001 > 55894 [ACK] Seq=95326 Ack=3201 Win=536 Len=1448 TSval=3420405224 TSecr=1468364303","55894","9001"
"1632","8.506250000","192.99.111.11","10.104.162.227","TCP","1514","9001 > 55894 [ACK] Seq=96774 Ack=3201 Win=536 Len=1448 TSval=3420405224 TSecr=1468364303","55894","9001"
"1634","8.506349000","192.99.111.11","10.104.162.227","TCP","1514","9001 > 55894 [ACK] Seq=98222 Ack=3201 Win=536 Len=1448 TSval=3420405224 TSecr=1468364303","55894","9001"
"1636","8.506519000","192.99.111.11","10.104.162.227","TCP","1514","9001 > 55894 [ACK] Seq=99670 Ack=3201 Win=536 Len=1448 TSval=3420405224 TSecr=1468364303","55894","9001"
"1637","8.506520000","192.99.111.11","10.104.162.227","TCP","1514","9001 > 55894 [ACK] Seq=101118 Ack=3201 Win=536 Len=1448 TSval=3420405224 TSecr=1468364303","55894","9001"
"1640","8.516924000","192.99.111.11","10.104.162.227","TCP","1514","9001 > 55894 [ACK] Seq=102566 Ack=3201 Win=536 Len=1448 TSval=3420405224 TSecr=1468364303","55894","9001"
"1641","8.516928000","192.99.111.11","10.104.162.227","TCP","1514","9001 > 55894 [ACK] Seq=104014 Ack=3201 Win=536 Len=1448 TSval=3420405224 TSecr=1468364303","55894","9001"
"1643","8.517167000","192.99.111.11","10.104.162.227","TCP","1514","9001 > 55894 [ACK] Seq=105462 Ack=3201 Win=536 Len=1448 TSval=3420405225 TSecr=1468364305","55894","9001"
"1644","8.517170000","192.99.111.11","10.104.162.227","TCP","1514","9001 > 55894 [ACK] Seq=106910 Ack=3201 Win=536 Len=1448 TSval=3420405225 TSecr=1468364305","55894","9001"
"1645","8.517172000","192.99.111.11","10.104.162.227","TCP","1514","9001 > 55894 [ACK] Seq=108358 Ack=3201 Win=536 Len=1448 TSval=3420405225 TSecr=1468364305","55894","9001"
"1646","8.517173000","192.99.111.11","10.104.162.227","TCP","1514","9001 > 55894 [ACK] Seq=109806 Ack=3201 Win=536 Len=1448 TSval=3420405226 TSecr=1468364305","55894","9001"
"1647","8.517174000","192.99.111.11","10.104.162.227","TCP","1514","9001 > 55894 [ACK] Seq=111254 Ack=3201 Win=536 Len=1448 TSval=3420405226 TSecr=1468364305","55894","9001"
"1648","8.517175000","192.99.111.11","10.104.162.227","TCP","1514","9001 > 55894 [ACK] Seq=112702 Ack=3201 Win=536 Len=1448 TSval=3420405227 TSecr=1468364305","55894","9001"
"1649","8.517177000","192.99.111.11","10.104.162.227","TCP","1514","9001 > 55894 [ACK] Seq=114150 Ack=3201 Win=536 Len=1448 TSval=3420405227 TSecr=1468364306","55894","9001"
"1650","8.517178000","192.99.111.11","10.104.162.227","TCP","1514","9001 > 55894 [ACK] Seq=115598 Ack=3201 Win=536 Len=1448 TSval=3420405227 TSecr=1468364306","55894","9001"
"1651","8.517180000","192.99.111.11","10.104.162.227","TCP","1514","9001 > 55894 [ACK] Seq=117046 Ack=3201 Win=536 Len=1448 TSval=3420405227 TSecr=1468364306","55894","9001"
"1652","8.517181000","192.99.111.11","10.104.162.227","TCP","1514","9001 > 55894 [ACK] Seq=118494 Ack=3201 Win=536 Len=1448 TSval=3420405230 TSecr=1468364306","55894","9001"
"1653","8.517183000","192.99.111.11","10.104.162.227","TCP","1514","9001 > 55894 [ACK] Seq=119942 Ack=3201 Win=536 Len=1448 TSval=3420405230 TSecr=1468364306","55894","9001"
"1661","8.517533000","10.104.162.227","192.99.111.11","TCP","609","55894 > 9001 [PSH, ACK] Seq=3201 Ack=121390 Win=7509 Len=543 TSval=1468364357 TSecr=3420405230","9001","55894"
"1664","8.522608000","192.99.111.11","10.104.162.227","TCP","1514","9001 > 55894 [ACK] Seq=121390 Ack=3201 Win=536 Len=1448 TSval=3420405230 TSecr=1468364306","55894","9001"
"1665","8.528402000","192.99.111.11","10.104.162.227","TCP","1514","9001 > 55894 [ACK] Seq=122838 Ack=3201 Win=536 Len=1448 TSval=3420405246 TSecr=1468364324","55894","9001"
"1666","8.528407000","192.99.111.11","10.104.162.227","TCP","1514","9001 > 55894 [ACK] Seq=124286 Ack=3201 Win=536 Len=1448 TSval=3420405246 TSecr=1468364324","55894","9001"
"1668","8.528597000","192.99.111.11","10.104.162.227","TCP","1514","9001 > 55894 [ACK] Seq=125734 Ack=3201 Win=536 Len=1448 TSval=3420405246 TSecr=1468364324","55894","9001"
"1669","8.528600000","192.99.111.11","10.104.162.227","TCP","1514","9001 > 55894 [ACK] Seq=127182 Ack=3201 Win=536 Len=1448 TSval=3420405246 TSecr=1468364324","55894","9001"
"1672","8.540774000","192.99.111.11","10.104.162.227","TCP","1514","9001 > 55894 [ACK] Seq=128630 Ack=3201 Win=536 Len=1448 TSval=3420405270 TSecr=1468364347","55894","9001"
"1673","8.540801000","192.99.111.11","10.104.162.227","TCP","1514","9001 > 55894 [ACK] Seq=130078 Ack=3201 Win=536 Len=1448 TSval=3420405270 TSecr=1468364347","55894","9001"
"1674","8.540802000","192.99.111.11","10.104.162.227","TCP","1514","9001 > 55894 [ACK] Seq=131526 Ack=3201 Win=536 Len=1448 TSval=3420405270 TSecr=1468364347","55894","9001"
"1675","8.540863000","192.99.111.11","10.104.162.227","TCP","1514","9001 > 55894 [ACK] Seq=132974 Ack=3201 Win=536 Len=1448 TSval=3420405270 TSecr=1468364347","55894","9001"
"1676","8.540889000","192.99.111.11","10.104.162.227","TCP","1514","9001 > 55894 [ACK] Seq=134422 Ack=3201 Win=536 Len=1448 TSval=3420405271 TSecr=1468364347","55894","9001"
"1680","8.541860000","192.99.111.11","10.104.162.227","TCP","1514","9001 > 55894 [ACK] Seq=135870 Ack=3201 Win=536 Len=1448 TSval=3420405271 TSecr=1468364347","55894","9001"
"1681","8.541865000","192.99.111.11","10.104.162.227","TCP","1514","9001 > 55894 [ACK] Seq=137318 Ack=3201 Win=536 Len=1448 TSval=3420405271 TSecr=1468364347","55894","9001"
"1684","8.549456000","192.99.111.11","10.104.162.227","TCP","1514","9001 > 55894 [ACK] Seq=138766 Ack=3201 Win=536 Len=1448 TSval=3420405279 TSecr=1468364357","55894","9001"
"1685","8.549461000","192.99.111.11","10.104.162.227","TCP","1514","9001 > 55894 [ACK] Seq=140214 Ack=3201 Win=536 Len=1448 TSval=3420405279 TSecr=1468364357","55894","9001"
"1686","8.549558000","192.99.111.11","10.104.162.227","TCP","1514","9001 > 55894 [ACK] Seq=141662 Ack=3201 Win=536 Len=1448 TSval=3420405279 TSecr=1468364357","55894","9001"
"1689","8.549716000","192.99.111.11","10.104.162.227","TCP","1514","9001 > 55894 [ACK] Seq=143110 Ack=3201 Win=536 Len=1448 TSval=3420405279 TSecr=1468364357","55894","9001"
"1690","8.549751000","192.99.111.11","10.104.162.227","TCP","1514","9001 > 55894 [ACK] Seq=144558 Ack=3201 Win=536 Len=1448 TSval=3420405279 TSecr=1468364357","55894","9001"
"1693","8.550296000","192.99.111.11","10.104.162.227","TCP","1514","9001 > 55894 [ACK] Seq=146006 Ack=3201 Win=536 Len=1448 TSval=3420405279 TSecr=1468364357","55894","9001"
"1694","8.550301000","192.99.111.11","10.104.162.227","TCP","1514","9001 > 55894 [ACK] Seq=147454 Ack=3201 Win=536 Len=1448 TSval=3420405279 TSecr=1468364357","55894","9001"
"1696","8.550481000","192.99.111.11","10.104.162.227","TCP","1514","9001 > 55894 [ACK] Seq=148902 Ack=3201 Win=536 Len=1448 TSval=3420405279 TSecr=1468364357","55894","9001"
"1698","8.551995000","192.99.111.11","10.104.162.227","TCP","1514","9001 > 55894 [ACK] Seq=150350 Ack=3201 Win=536 Len=1448 TSval=3420405279 TSecr=1468364357","55894","9001"
"1699","8.551999000","192.99.111.11","10.104.162.227","TCP","1514","9001 > 55894 [ACK] Seq=151798 Ack=3201 Win=536 Len=1448 TSval=3420405279 TSecr=1468364357","55894","9001"
"1700","8.552000000","192.99.111.11","10.104.162.227","TCP","1514","9001 > 55894 [ACK] Seq=153246 Ack=3201 Win=536 Len=1448 TSval=3420405279 TSecr=1468364357","55894","9001"
"1701","8.552001000","192.99.111.11","10.104.162.227","TCP","1213","9001 > 55894 [PSH, ACK] Seq=154694 Ack=3201 Win=536 Len=1147 TSval=3420405279 TSecr=1468364357","55894","9001"
"1702","8.552002000","192.99.111.11","10.104.162.227","TCP","1514","9001 > 55894 [ACK] Seq=155841 Ack=3201 Win=536 Len=1448 TSval=3420405279 TSecr=1468364357","55894","9001"
"1703","8.552003000","192.99.111.11","10.104.162.227","TCP","1514","9001 > 55894 [ACK] Seq=157289 Ack=3201 Win=536 Len=1448 TSval=3420405280 TSecr=1468364357","55894","9001"
"1704","8.552004000","192.99.111.11","10.104.162.227","TCP","1514","9001 > 55894 [ACK] Seq=158737 Ack=3201 Win=536 Len=1448 TSval=3420405280 TSecr=1468364357","55894","9001"
"1711","8.590992000","10.104.162.227","192.99.111.11","TCP","609","55894 > 9001 [PSH, ACK] Seq=3744 Ack=160185 Win=8192 Len=543 TSval=1468364427 TSecr=3420405320","9001","55894"
"1723","8.673518000","192.99.111.11","10.104.162.227","TCP","1514","9001 > 55894 [ACK] Seq=160185 Ack=3744 Win=536 Len=1448 TSval=3420405400 TSecr=1468364367","55894","9001"
"1724","8.673523000","192.99.111.11","10.104.162.227","TCP","1514","9001 > 55894 [ACK] Seq=161633 Ack=3744 Win=536 Len=1448 TSval=3420405400 TSecr=1468364367","55894","9001"
"1725","8.673524000","192.99.111.11","10.104.162.227","TCP","1514","9001 > 55894 [ACK] Seq=163081 Ack=3744 Win=536 Len=1448 TSval=3420405400 TSecr=1468364367","55894","9001"
"1728","8.680118000","192.99.111.11","10.104.162.227","TCP","1514","9001 > 55894 [ACK] Seq=164529 Ack=3744 Win=536 Len=1448 TSval=3420405400 TSecr=1468364367","55894","9001"
"1729","8.680124000","192.99.111.11","10.104.162.227","TCP","1514","9001 > 55894 [ACK] Seq=165977 Ack=3744 Win=536 Len=1448 TSval=3420405400 TSecr=1468364367","55894","9001"
"1730","8.680125000","192.99.111.11","10.104.162.227","TCP","1514","9001 > 55894 [ACK] Seq=167425 Ack=3744 Win=536 Len=1448 TSval=3420405405 TSecr=1468364379","55894","9001"
"1731","8.680162000","192.99.111.11","10.104.162.227","TCP","1514","9001 > 55894 [ACK] Seq=168873 Ack=3744 Win=536 Len=1448 TSval=3420405405 TSecr=1468364379","55894","9001"
"1734","8.680312000","192.99.111.11","10.104.162.227","TCP","1514","9001 > 55894 [ACK] Seq=170321 Ack=3744 Win=536 Len=1448 TSval=3420405405 TSecr=1468364379","55894","9001"
"1735","8.680461000","192.99.111.11","10.104.162.227","TCP","1514","9001 > 55894 [ACK] Seq=171769 Ack=3744 Win=536 Len=1448 TSval=3420405405 TSecr=1468364379","55894","9001"
"1738","8.681761000","192.99.111.11","10.104.162.227","TCP","1514","9001 > 55894 [ACK] Seq=173217 Ack=3744 Win=536 Len=1448 TSval=3420405405 TSecr=1468364379","55894","9001"
"1739","8.681766000","192.99.111.11","10.104.162.227","TCP","1514","9001 > 55894 [ACK] Seq=174665 Ack=3744 Win=536 Len=1448 TSval=3420405405 TSecr=1468364380","55894","9001"
"1741","8.681986000","192.99.111.11","10.104.162.227","TCP","1514","9001 > 55894 [ACK] Seq=176113 Ack=3744 Win=536 Len=1448 TSval=3420405405 TSecr=1468364380","55894","9001"
"1742","8.681990000","192.99.111.11","10.104.162.227","TCP","1514","9001 > 55894 [ACK] Seq=177561 Ack=3744 Win=536 Len=1448 TSval=3420405405 TSecr=1468364380","55894","9001"
"1744","8.682089000","192.99.111.11","10.104.162.227","TCP","1514","9001 > 55894 [ACK] Seq=179009 Ack=3744 Win=536 Len=1448 TSval=3420405405 TSecr=1468364380","55894","9001"
"1747","8.682628000","192.99.111.11","10.104.162.227","TCP","1514","9001 > 55894 [ACK] Seq=180457 Ack=3744 Win=536 Len=1448 TSval=3420405405 TSecr=1468364387","55894","9001"
"1748","8.682631000","192.99.111.11","10.104.162.227","TCP","1514","9001 > 55894 [ACK] Seq=181905 Ack=3744 Win=536 Len=1448 TSval=3420405405 TSecr=1468364387","55894","9001"
"1749","8.682719000","192.99.111.11","10.104.162.227","TCP","1514","9001 > 55894 [ACK] Seq=183353 Ack=3744 Win=536 Len=1448 TSval=3420405405 TSecr=1468364387","55894","9001"
"1751","8.682863000","192.99.111.11","10.104.162.227","TCP","1514","9001 > 55894 [ACK] Seq=184801 Ack=3744 Win=536 Len=1448 TSval=3420405405 TSecr=1468364387","55894","9001"
"1752","8.682889000","192.99.111.11","10.104.162.227","TCP","1514","9001 > 55894 [ACK] Seq=186249 Ack=3744 Win=536 Len=1448 TSval=3420405405 TSecr=1468364387","55894","9001"
"1756","8.687349000","192.99.111.11","10.104.162.227","TCP","1514","9001 > 55894 [ACK] Seq=187697 Ack=3744 Win=536 Len=1448 TSval=3420405405 TSecr=1468364387","55894","9001"
"1757","8.687375000","192.99.111.11","10.104.162.227","TCP","1514","9001 > 55894 [ACK] Seq=189145 Ack=3744 Win=536 Len=1448 TSval=3420405405 TSecr=1468364388","55894","9001"
"1759","8.687577000","192.99.111.11","10.104.162.227","TCP","1514","9001 > 55894 [ACK] Seq=190593 Ack=3744 Win=536 Len=1448 TSval=3420405405 TSecr=1468364388","55894","9001"
"1761","8.687795000","192.99.111.11","10.104.162.227","TCP","1514","9001 > 55894 [ACK] Seq=192041 Ack=3744 Win=536 Len=1448 TSval=3420405405 TSecr=1468364388","55894","9001"
"1762","8.687820000","192.99.111.11","10.104.162.227","TCP","1514","9001 > 55894 [ACK] Seq=193489 Ack=3744 Win=536 Len=1448 TSval=3420405405 TSecr=1468364389","55894","9001"
"1765","8.688555000","192.99.111.11","10.104.162.227","TCP","1514","9001 > 55894 [ACK] Seq=194937 Ack=3744 Win=536 Len=1448 TSval=3420405405 TSecr=1468364389","55894","9001"
"1766","8.688559000","192.99.111.11","10.104.162.227","TCP","1514","9001 > 55894 [ACK] Seq=196385 Ack=3744 Win=536 Len=1448 TSval=3420405405 TSecr=1468364389","55894","9001"
"1768","8.688712000","192.99.111.11","10.104.162.227","TCP","1514","9001 > 55894 [ACK] Seq=197833 Ack=3744 Win=536 Len=1448 TSval=3420405405 TSecr=1468364389","55894","9001"
"1769","8.688739000","192.99.111.11","10.104.162.227","TCP","1514","9001 > 55894 [ACK] Seq=199281 Ack=3744 Win=536 Len=1448 TSval=3420405405 TSecr=1468364389","55894","9001"
"1772","8.688983000","192.99.111.11","10.104.162.227","TCP","1514","9001 > 55894 [ACK] Seq=200729 Ack=3744 Win=536 Len=1448 TSval=3420405405 TSecr=1468364389","55894","9001"
"1774","8.689364000","192.99.111.11","10.104.162.227","TCP","1514","9001 > 55894 [ACK] Seq=202177 Ack=3744 Win=536 Len=1448 TSval=3420405405 TSecr=1468364389","55894","9001"
"1775","8.689367000","192.99.111.11","10.104.162.227","TCP","1514","9001 > 55894 [ACK] Seq=203625 Ack=3744 Win=536 Len=1448 TSval=3420405405 TSecr=1468364389","55894","9001"
"1798","8.714228000","192.99.111.11","10.104.162.227","TCP","1514","9001 > 55894 [ACK] Seq=205073 Ack=4287 Win=536 Len=1448 TSval=3420405441 TSecr=1468364427","55894","9001"
"1799","8.714239000","192.99.111.11","10.104.162.227","TCP","1514","9001 > 55894 [ACK] Seq=206521 Ack=4287 Win=536 Len=1448 TSval=3420405441 TSecr=1468364427","55894","9001"
"1800","8.714278000","192.99.111.11","10.104.162.227","TCP","1514","9001 > 55894 [ACK] Seq=207969 Ack=4287 Win=536 Len=1448 TSval=3420405441 TSecr=1468364427","55894","9001"
"1803","8.718421000","192.99.111.11","10.104.162.227","TCP","1514","9001 > 55894 [ACK] Seq=209417 Ack=4287 Win=536 Len=1448 TSval=3420405445 TSecr=1468364509","55894","9001"
"1804","8.718425000","192.99.111.11","10.104.162.227","TCP","1514","9001 > 55894 [ACK] Seq=210865 Ack=4287 Win=536 Len=1448 TSval=3420405445 TSecr=1468364515","55894","9001"
"1807","8.718715000","10.104.162.227","192.99.111.11","TCP","609","55894 > 9001 [PSH, ACK] Seq=4287 Ack=212313 Win=8192 Len=543 TSval=1468364551 TSecr=3420405445","9001","55894"
"1808","8.720509000","192.99.111.11","10.104.162.227","TCP","1514","9001 > 55894 [ACK] Seq=212313 Ack=4287 Win=536 Len=1448 TSval=3420405445 TSecr=1468364515","55894","9001"
"1809","8.720512000","192.99.111.11","10.104.162.227","TCP","1514","9001 > 55894 [ACK] Seq=213761 Ack=4287 Win=536 Len=1448 TSval=3420405445 TSecr=1468364515","55894","9001"
"1812","8.722082000","192.99.111.11","10.104.162.227","TCP","1514","9001 > 55894 [ACK] Seq=215209 Ack=4287 Win=536 Len=1448 TSval=3420405451 TSecr=1468364515","55894","9001"
"1813","8.722085000","192.99.111.11","10.104.162.227","TCP","1514","9001 > 55894 [ACK] Seq=216657 Ack=4287 Win=536 Len=1448 TSval=3420405451 TSecr=1468364515","55894","9001"
"1814","8.722106000","192.99.111.11","10.104.162.227","TCP","1514","9001 > 55894 [ACK] Seq=218105 Ack=4287 Win=536 Len=1448 TSval=3420405451 TSecr=1468364515","55894","9001"
"1817","8.722326000","192.99.111.11","10.104.162.227","TCP","1514","9001 > 55894 [ACK] Seq=219553 Ack=4287 Win=536 Len=1448 TSval=3420405451 TSecr=1468364515","55894","9001"
"1818","8.722329000","192.99.111.11","10.104.162.227","TCP","453","9001 > 55894 [PSH, ACK] Seq=221001 Ack=4287 Win=536 Len=387 TSval=3420405451 TSecr=1468364516","55894","9001"
"1820","8.725035000","192.99.111.11","10.104.162.227","TCP","1514","9001 > 55894 [ACK] Seq=221388 Ack=4287 Win=536 Len=1448 TSval=3420405454 TSecr=1468364517","55894","9001"
"1821","8.725038000","192.99.111.11","10.104.162.227","TCP","1514","9001 > 55894 [ACK] Seq=222836 Ack=4287 Win=536 Len=1448 TSval=3420405454 TSecr=1468364517","55894","9001"
"1824","8.764231000","192.99.111.11","10.104.162.227","TCP","312","9001 > 55894 [PSH, ACK] Seq=224284 Ack=4830 Win=536 Len=246 TSval=3420405485 TSecr=1468364551","55894","9001"
"2240","12.600763000","192.99.111.11","10.104.162.227","TCP","609","9001 > 55894 [PSH, ACK] Seq=224530 Ack=4830 Win=536 Len=543 TSval=3420409325 TSecr=1468364595","55894","9001"
